id,screen_name,text,clean_text,dt,label_id,is_predict,label_name,label,Desc
638,Poldakaltim,"https://t.co/euhH1U6glM, KUTIM – Kepolisian Resor Kutai Timur, Kamis (14/7/2022) menggelar rapat koordinasi dengan pihak terkait guna mengantisipasi terjadinya kebakaran hutan dan lahan (Karhutla) di wilayah Kabupaten Kutai Timur.
.
.
.
#Poldakaltim #Kaltim #kamihumaspolri https://t.co/8BouosXKvc",tim polisi resor kuta timur kamis gelar rapat koordinasi pihak kait antisipasi jadi bakar hutan lahan karhutla wilayah kabupaten kuta timurpoldakaltim kaltim kamihumaspolri,2022-07-15 10:12:30,1,1,pencegahan,pencegahan,
639,polisisijunjung,Kasat Binmas Pimpin Kegiatan Satgas Berikan Penyuluhan Antisipasi Karhutla di Muaro dan Silokek - DIVISI HUMAS POLRI https://t.co/DcrrvqXS0R https://t.co/HoMdQ0WTou,kasat binmas pimpin giat satgas ikan suluh antisipasi karhutla muaro silokek divisi humas polri,2022-07-15 10:18:44,1,1,pencegahan,unknow,
640,inrachma,@tvOneNews Tuh makanya ya jgn seenaknua nyalahin penanggulangan karhutla di Indonesia,tuh makanya jgn seenaknua nyalahin tanggulang karhutla indonesia,2022-07-15 10:48:20,2,1,kebakaran,unknow,
641,posmetro_padang,Wagub Audy Apresiasi Perusahaan BRM Cegah Karhutla Sejak Dini https://t.co/HLtRkpZSaQ,wagub audy apresiasi usaha brm cegah karhutla sejakdini,2022-07-15 11:12:53,2,1,kebakaran,mitigasi,
642,MedialokalCo,Himbau Warga Terkait Karhutla Oleh Babinsa Koramil 04/Kuindra https://t.co/SaRhCyGldA https://t.co/HwfYvxlKqu,himbau warga kait karhutla babinsa koramil indra,2022-07-15 12:02:06,2,1,kebakaran,pencegahan,
643,RRIPrograma3,"#LAPORANREPORTER

Satgas karhutla minta perusahaan aktif cegah kebakaran hutan dan lahan. Reporter RRI (TP)

Selengkapnya dengarkan di 88,8FM, RRINET &amp; RRI PlayGo. -AMD",laporanreportersatgas karhutla minta usaha aktif cegah bakar hutan lahan reporter rri tpselengkapnya dengar fm rrinet amp rri playgo amd,2022-07-15 12:32:47,5,1,rehabilitasi,pencegahan,
644,beritasampit_id,"#BeritaSampit
Antisipasi Karhutla, Wabup Sukamara Pimpin Apel Personel dan Sapras  https://t.co/y4nRa0a3mX SUKAMARA - Wakil Bupati Sukamara Ahmadi memimpin apel gelar Personel dan Sapras di Hala... https://t.co/DO6LmYiJED",beritasampitantisipasi karhutla wabup sukamara pimpin apel personel sapras sukamara wakil bupati sukamara ahmadi pimpin apel gelar personel sapras hala,2022-07-15 12:59:12,1,1,pencegahan,pencegahan,
645,beritasampit_id,"#BeritaSampit
Polres Sukamara Siap Antisipasi Karhutla https://t.co/kyCmTYWQPv SUKAMARA - Kapolres Sukamara AKBP Dewa Made Palguna mengatakan bahwa pihaknya telah menyiapkan personel dan sarana prasarana untuk mengantisip... https://t.co/AEWnyHBMKz",beritasampitpolres sukamara siap antisipasi karhutla sukamara kapolres sukamara akbp dewa made palguna kata pihak siap personel sarana prasarana mengantisip,2022-07-15 13:13:19,2,1,kebakaran,pencegahan,
646,MedialokalCo,Sertu A. Hayat Lakukan Pencegahan Terkait Karhutla di Desa Kemuning Tua https://t.co/jmWZ0uwMRD https://t.co/RhlRyJSNBS,sertu a hayat laku cegah kait karhutla desa kemuning tua,2022-07-15 13:16:08,1,1,pencegahan,pencegahan,
648,BpbdIlir,Apel dan Patroli siaga Karhutla Tahun 2022 https://t.co/1VxoWbgvLB,apel patroli siaga karhutla tahun,2022-07-15 14:39:59,2,1,kebakaran,pencegahan,
649,BpbdIlir,Siaga Karhutla Tahun 2022 https://t.co/6u5rXggmMO,siaga karhutla tahun,2022-07-15 14:42:07,3,1,unknow,kebakaran,
650,jpnncom,"Peningkatan titik api terjadi di Sumbar. Pada 2022, titik api di Sumbar mencapai 484 lokasi. #Karhutla https://t.co/oyn1m48NmY",tingkat titik api jadi sumbar titik api sumbar capai lokasi karhutla,2022-07-15 15:15:02,3,1,unknow,kebakaran,
651,gardajambi45,"Brigjen TNI Supriono berharap bisa mengurangi luasan lahan kebakaran, sehingga tahun ini karhutla di Provinsi Jambi bisa dicegah.
#TNIADMengabdiDanMembangunBersamaRakyat

https://t.co/rO73IX8QuC",brigjen tni supriono harap kurang luas lahan bakar tahun karhutla provinsi jambi dicegahtniadmengabdidanmembangunbersamarakyat,2022-07-15 15:17:40,1,1,pencegahan,pencegahan,
652,Beritabaruco,"Kebakaran Hutan di Barat Daya Prancis Menyebar, Ratusan Warga Dievakuasi dari Rumah https://t.co/SBTy7xKprW #GelombangPanasEkstrim #kebakaranhutan #Prancis https://t.co/t0BqHh8Be2",bakar hutan barat daya prancis sebar ratus warga evakuasi rumah gelombangpanasekstrim kebakaranhutan prancis,2022-07-15 16:26:09,1,1,pencegahan,penanggulangan,
653,antaranews,"Kabupaten OKU Timur tetapkan status siaga karhutla menghadapi musim kemarau tahun ini agar bencana kabut asap dapat ditanggulangi sedini mungkin.

https://t.co/e7KETCSqU5",kabupaten oku timur tetap status siaga karhutla hadap musim kemarau tahun agar bencana kabut asap tanggulang din mungkin,2022-07-15 16:56:10,1,1,pencegahan,pencegahan,
654,Klasterkarhutla,"BPBD, Manggala Agni dan Perusahaan tergabung klaster Pengendalian Karhutla Kab.OKI ""PT.Rambang Agro Jaya"" melakukan patroli bersama untuk pencegahan karhutla kawasan Gambut. Selanjutnya akan dilakukan kegiatan bersama di Sub klaster lainnya. Jum'at (15/7/2022). https://t.co/2i4RxgDIzB",bpbd manggala agni usaha gabung klaster kendali karhutla kaboki ptrambang agro jaya laku patroli sama cegah karhutla kawasan gambut lanjut laku giat sama sub klaster jumat,2022-07-15 17:39:09,2,1,kebakaran,pencegahan,
655,Klasterkarhutla,"RT @Klasterkarhutla: BPBD, Manggala Agni dan Perusahaan tergabung klaster Pengendalian Karhutla Kab.OKI ""PT.Rambang Agro Jaya"" melakukan pa…",bpbd manggala agni usaha gabung klaster kendali karhutla kaboki ptrambang agro jaya laku pa,2022-07-15 17:39:29,1,1,pencegahan,pencegahan,
656,merdekadotcom,OKU Timur Sumsel Siaga Karhutla https://t.co/ftCMOoW7di,oku timur sumsel siaga karhutla,2022-07-15 18:04:37,2,1,kebakaran,pencegahan,
657,Metrobatam1,Polsek Bengkong Sosialisasi Stop Karhutla di Wilayahnya https://t.co/8QavKHxqWv,polsek bengkong sosialisasi stop karhutla wilayah,2022-07-15 18:30:04,2,1,kebakaran,pencegahan,
658,monopol51243953,Antisipasi Karhutla Satbinmas Polres Ogan Ilir Bersama TNI Lakukan Giat Patroli https://t.co/Bky7txysab,antisipasi karhutla satbinmas polres ogan ilir sama tni laku giatpatroli,2022-07-15 19:05:14,1,1,pencegahan,pencegahan,
659,info_rahmi,"Satu hektare lahan di Pidie Jaya terbakar di tengah kemarau basah #beritaindo #beritaterkini #indonews

masyarakat masih membuka lahan dengan membakar sebagai jalan keluar yang lebih praktis

Banda Aceh (ARSIP DUNIA) – Kebakaran hutan dan lahan (Karhutla) kembali terjadi pad… https://t.co/KSdHRbAKqH",satu hektare lahan pidie jaya bakar tengah kemarau basah beritaindo beritaterkini indonewsmasyarakat buka lahan bakar bagai jalan keluar lebih praktisbanda aceh arsip dunia bakar hutan lahan karhutla jadi pad,2022-07-15 19:39:14,2,1,kebakaran,kebakaran,
661,h3nd4r,RT @antaranews: Kabupaten OKU Timur tetapkan status siaga karhutla menghadapi musim kemarau tahun ini agar bencana kabut asap dapat ditangg…,kabupaten oku timur tetap status siaga karhutla hadap musim kemarau tahun agar bencana kabut asap ditangg,2022-07-15 20:12:53,1,1,pencegahan,pencegahan,
662,halloriau,"Ratusan Siswa SMAN 1 Pekanbaru Antusias Ikut Simulasi Pencegahan Karhutla Bersama Arara Abadi

https://t.co/3elRZOSWws",ratus siswa sman pekanbaru antusias ikut simulasi cegah karhutla sama arara abadi,2022-07-15 20:29:32,1,1,pencegahan,pencegahan,
664,Konfrontasi_co,OKU Timur Tetapkan Status Siaga Karhutla https://t.co/w6k2V83DS8,oku timur tetap status siaga karhutla,2022-07-15 21:07:34,2,1,kebakaran,pencegahan,
665,infobmkgkalbar,"Hai Sobat Info BMKG Kalbar,
Waspada potensi kemudahan terjadinya kebakaran hutan dan lahan di wilayah Kalimantan Barat tanggal 16 s.d 19 Juli 2022
#karhutla 
#karhutlakalbar 
#infobmkgkalbar 
#cuacakalbar https://t.co/LKxKsAVj5q",hai sobat info bmkg kalbarwaspada potensi mudah jadi bakar hutan lahan wilayah kalimantan barat tanggal sd juli karhutla karhutlakalbar infobmkgkalbar cuacakalbar,2022-07-16 9:07:26,1,1,pencegahan,kebakaran,
666,voidotid,Danrem 042/Gapu Brigjen TNI Supriono menegaskan akan mengecek semua perusahaan perkebunan di Jambi yang mangkir rapat pencegahan karhutla bareng BPBD. https://t.co/iBUGWH1NbS,danrem gapu brigjen tni supriono tegas ecek semua usaha kebun jambi mangkir rapat cegah karhutla bareng bpbd,2022-07-16 10:15:19,1,1,pencegahan,pencegahan,
668,masihpunyawaktu,RT @voidotid: Danrem 042/Gapu Brigjen TNI Supriono menegaskan akan mengecek semua perusahaan perkebunan di Jambi yang mangkir rapat pencega…,danrem gapu brigjen tni supriono tegas ecek semua usaha kebun jambi mangkir rapat pencega,2022-07-16 10:17:13,1,1,pencegahan,pencegahan,
669,GentalaMedia,"Lagi, Karhutla Landa Aceh Besar

 #BPBDAcehBesar #Karhutla #Kebakaranlahan #gentalamedia
https://t.co/FICquTmjur",karhutla landa aceh besar bpbdacehbesar karhutla kebakaranlahan gentalamedia,2022-07-16 11:19:02,2,1,kebakaran,kebakaran,
670,MedialokalCo,Babinsa Koramil 04/Kuindra Himbau Dampak Yang Terjadi Pada Karhutla https://t.co/MTKVYsfS1K https://t.co/gQPde04EJC,babinsa koramil indra himbau dampak jadi karhutla,2022-07-16 11:53:10,2,1,kebakaran,kebakaran,
671,MedialokalCo,Himbauan Terhadap Patroli Karhutla Oleh Babinsa Koramil 07/Reteh di Wilayah Binaan https://t.co/oe3sh4BpqY https://t.co/WujTjepvgH,himbauan hadap patroli karhutla babinsa koramil reteh wilayah bina,2022-07-16 11:53:13,1,1,pencegahan,pencegahan,
672,MedialokalCo,"Ajak Mahasiswa KKN, Babinsa Koramil 03/Tempuling Lakukan Patroli Karhutla Bersama https://t.co/cJHSuCXTQj https://t.co/iOJJPlD0Pg",ajak mahasiswa kkn babinsa koramil tempuling laku patroli karhutla sama,2022-07-16 12:01:40,1,1,pencegahan,pencegahan,
673,dadozrock,@NAndrianto21 @ChikiRasa @Dhanisip @yourfriendd0 @KompasTV Elo yg blok goblok ??  soal karhutla tau gak ?,elo yg blok goblok soal karhutla tau gak,2022-07-16 12:16:45,2,1,kebakaran,unknow,
674,kodim0313kpr,Babinsa Koramil 03 Bunut Selalu Mengintensifkan Patroli Guna Antisipasi Terjadinya Karhutla https://t.co/I8Mx6gn56F,babinsa koramil bunut selalu intensif patroli antisipasi jadi karhutla,2022-07-16 12:30:37,1,1,pencegahan,pencegahan,
675,red_Beritapojok,Babinsa Kelurahan Mundam Lakukan Patroli dan Sosialisasi Rutin untuk Cegah Karhutla https://t.co/FCjnLVQyZ2,babinsa lurah mundam laku patroli sosialisasi rutin cegahkarhutla,2022-07-16 12:35:06,2,1,kebakaran,pencegahan,
676,kodim0313kpr,Babinsa Koramil 12/XIII Koto Kampar Laksanakan Patroli dan Sosialisasi Karhutla https://t.co/xoNzKK4Oia,babinsa koramil xi koto kampar laksana patroli sosialisasi karhutla,2022-07-16 12:51:37,1,1,pencegahan,pencegahan,
677,BERITAKINI_CO,"Masuk Hari Ketiga, Pemadaman Hutan di Prancis Masih Belum Berhasil. #prancis #kebakaranhutan #hutan #beritakini #NewsFlash https://t.co/DfVGRQrmsa",masuk hari tiga madam hutan prancis belum hasil prancis kebakaranhutan hutan beritakini newsflash,2022-07-16 12:55:22,2,1,kebakaran,kebakaran,
678,Line_LKH,Babinsa Kelurahan Mundam Adakan Patroli dan Sosialisasi Cegah Karhutla https://t.co/FAfxtMxV1E,babinsa lurah mundam adakan patroli sosialisasi cegahkarhutla,2022-07-16 13:16:47,2,1,kebakaran,mitigasi,
679,SpiritRiau_com,Manggala Agni Daops Siak Cegah Karhutla dan Lakukan Patroli Terpadu https://t.co/0PsUPzZsXc,manggala agni daops siak cegah karhutla laku patroli padu,2022-07-16 13:46:49,1,1,pencegahan,unknow,
682,tega_ya,Pelajar SMAN 1 Diberi Edukasi dan Simulasi Penanggulangan Karhutla - Riau Terkini https://t.co/0xQP825mrm,ajar sman beri edukasi simulasi tanggulang karhutla riau kini,2022-07-16 14:50:45,1,1,pencegahan,pencegahan,
683,tega_ya,"Personel Polsek Dusun Hilir Sampaikan Edukasi, Cegah Dini Karhutla - DIVISI HUMAS POLRI https://t.co/v6joEotro5",personel polsek dusun hilir edukasi cegah dini karhutla divisi humas polri,2022-07-16 14:50:54,1,1,pencegahan,unknow,
684,SpiritRiau_com,"Berang, Wabup Rohil Sindir Perusahaan di Kecamatan Sinaboi yang Tidak Serius Tangani Karhutla https://t.co/Vn7s6QREua",berang wabup rohil sindir usaha camat sabo tidak serius tangan karhutla,2022-07-16 15:05:39,1,1,pencegahan,unknow,
685,jamindependent,Ini Pesan Danrem 042/Gapu Saat Buka Latihan Gabungan Penanganan Karhutla di Jambi https://t.co/YtnGjsPTH0,pesan danrem gapu buka latih gabung tangan karhutla jambi,2022-07-16 15:15:39,1,1,pencegahan,mitigasi,
686,gardajambi45,"Danrem 042/Gapu Brigjen TNI Supriono, selaku Plh Dansatgas Karhutla Provinsi Jambi membuka latihan gabungan penanganan bencana karhutla Provinsi Jambi tahun 2022, Sabtu 16 Juli 2022.
#TNIADMengabdiDanMembangunBersamaRakyat

https://t.co/ZzJ9hMim18",danrem gapu brigjen tni supriono selaku plh dansatgas karhutla provinsi jambi buka latih gabung tangan bencana karhutla provinsi jambi tahun sabtu juli tniadmengabdidanmembangunbersamarakyat,2022-07-16 17:00:09,2,1,kebakaran,mitigasi,
687,50Kodim,"Babinsa Nagari Lubuk Alai Koramil 07 Kapur IX Kodim 0306/50 Kota Serda Surianto meminta kepada masyarakat agar tidak membuka lahan dengan cara membakar hutan, hal ini untuk mencegah terjadinya kebakaran hutan dan lahan (karhutla) yang kerap terjadi pada saat musim kemarau tiba. https://t.co/mrToSTmXm0",babinsa nagari lubuk alai koramil kapur ix kodim kota serda surianto minta masyarakat tidak buka lahan cara bakar hutan ini cegah jadi bakar hutan lahan karhutla kerap jadi saat musim kemarau tiba,2022-07-16 18:10:33,1,1,pencegahan,pencegahan,
688,kordanewscom,Danrem 044/Gapo Tinjau Kesiapan Kabupaten Banyuasin Dalam Penanganan Karhutla https://t.co/cEDVcfkC7C,danrem gapo tinjau kesiap kabupaten banyuasin penanganankarhutla,2022-07-16 18:32:13,2,1,kebakaran,mitigasi,
691,polrespessell,"Polres Pessel Operasi Bina Karuna Langkisau 2022. Gencar Himbau Masyarakat Cegah Karhutla.
Selengkapnya⏬⏬
 https://t.co/YA0bYaan60
 https://t.co/G9kFhkBf2A
@KominfoPesisir @Satbinmaspessel @polsekkapas @humaspoldasumbar @divisihumaspolri https://t.co/NyTsra4rLB",polres pessel operasi bina karuna langkisau gencar himbau masyarakat cegah karhutlaselengkapnya,2022-07-16 20:42:17,1,1,pencegahan,pencegahan,
692,Sumsel_RMOL,https://t.co/eXhDmywPM9 -  Satu Pilot Pesawat Tewas saat Padamkan Karhutla di Portugal https://t.co/ubliL3lmLI,satu pilot pesawat tewas padam karhutla portugal,2022-07-16 21:46:05,2,1,kebakaran,penanggulangan,
693,tega_ya,Pelajar SMAN 1 Diberi Edukasi dan Simulasi Penanggulangan Karhutla - https://t.co/9XSZq9gcST https://t.co/CJwE5I0kSK,ajar sman beri edukasi simulasi tanggulang karhutla,2022-07-16 23:50:50,2,1,kebakaran,mitigasi,
694,GentalaMedia,"BPBD Aceh Besar Padamkan Hutan Cot Sireutoh Terbakar

 #BPBDAcehBesar #Karhutla #PemerintahAcehBesar #gentalamedia
https://t.co/09zK9XEHTP",bpbd aceh besar padam hutan cot sireutoh bakar bpbdacehbesar karhutla pemerintahacehbesar gentalamedia,2022-07-17 8:25:33,1,1,pencegahan,penanggulangan,
695,sekilas_riau,"Patroli dan Sosialisasi Karhutla, Babinsa Minta Warga Bersama Jaga Lingkungan https://t.co/t6tUrWmkRv",patroli sosialisasi karhutla babinsa minta warga sama jagalingkungan,2022-07-17 9:32:00,2,1,kebakaran,pencegahan,
696,MedialokalCo,Patroli Bekas Karhutla Oleh Babinsa Koramil 07/Reteh di Wilayah Parit 1 Kelurahan Metro https://t.co/HBV9PCiBgN https://t.co/epY2P8D0Fw,patroli bekas karhutla babinsa koramil reteh wilayah parit lurah metro,2022-07-17 10:23:36,1,1,pencegahan,pencegahan,
697,mediaindonesia,Operasi teknologi modifikasi cuaca akan dilaksanakan di Riau mulai Kamis (21/7). Hal itu dilakukan untuk mengantisipasi kebakaran hutan dan lahan di wilayah tersebut.  https://t.co/BDj62AoRVu,operasi teknologi modifikasi cuaca laksana riau mulai kamis itu laku antisipasi bakar hutan lahan wilayah sebut,2022-07-17 10:43:30,1,1,pencegahan,pencegahan,
698,InfoHumasBMKG,"Siang #SobatBMKG! Mimin punya info terbaru titik panas pada 17 Juli nih, yuk disimak?

Total 20 titik panas indikasi karhutla di wilayah Indonesia, yaitu Kalimantan Barat (18), NTT (1), dan Sumatera Utara (1).

Ayo jaga terus lingkungan kita!?
#TitikPanas
#BMKG https://t.co/JZnHaK7mWp",siang sobatbmkg mimin punya info baru titik panas juli nih yuk disimaktotal titik panas indikasi karhutla wilayah indonesia kalimantan barat ntt sumatera utara ayo jaga terus lingkung kitatitikpanasbmkg,2022-07-17 11:57:03,2,1,kebakaran,kebakaran,
699,MedialokalCo,Himbauan Terhadap Warga Terkait Menjaga Karhutla Di Wilayah Oleh Babinsa Koramil 04/Kuindra https://t.co/t0sHOz5J5J https://t.co/i3fc1Pf6wv,himbauan hadap warga kait jaga karhutla wilayah babinsa koramil indra,2022-07-17 12:13:03,1,1,pencegahan,pencegahan,
700,MedialokalCo,Babinsa Koramil 09/Kemuning Cegah Karhutla dan Sosialisasi Di Wilayah Binaan https://t.co/EDnY5IpsGX https://t.co/e5ozyxCyZB,babinsa koramil kemuning cegah karhutla sosialisasi wilayah bina,2022-07-17 12:45:06,2,1,kebakaran,pencegahan,
701,kodim0416bungo1,"Babinsa Koramil 416-05/Mt Dan Bhabinkamtibmas Patroli Rutin Dan Sosialisasi Karhutla

https://t.co/8Hj90f6xRS https://t.co/w8WA0pviDd",babinsa koramil mt bhabinkamtibmas patroli rutin sosialisasi karhutla,2022-07-17 13:30:02,2,1,kebakaran,mitigasi,
702,bisnisindo_id,"Potret Desa Wisata, Menjaring Cuan di Embung Karhutla https://t.co/y33sbFz4UX https://t.co/ILrLehigsc",potret desa wisata jaring cuan embung karhutla,2022-07-17 16:34:33,2,1,kebakaran,unknow,
703,Climate4life_,Informasi Hotspot dan Sebaran Asap Kebakaran Hutan dan Lahan Hari Ini https://t.co/euGOgPJ2nV,informasi hotspot sebar asap bakar hutan lahan hari,2022-07-17 17:08:00,2,1,kebakaran,kebakaran,
704,slowhend,dingin dingin begini enaknya diselimuti asap karhutla,dingin dingin begini enak limut asap karhutla,2022-07-17 17:26:23,2,1,kebakaran,unknow,
705,WidyanaHilda,Bhabinkamtibmas Juking Pajang Gencar Berikan Imbauan Larangan Karhutla https://t.co/LFxMZ198Hl https://t.co/lwZI2StZGN,bhabinkamtibmas juking pajang gencar ikan imbau larang karhutla,2022-07-17 17:51:14,2,1,kebakaran,pencegahan,
706,tbnewsresoku,"Polres Oku Gencar Lakukan Sosialisasi, Antisipasi Cegah Karhutla https://t.co/HwcSbJ33wy",polres oku gencar laku sosialisasi antisipasi cegahkarhutla,2022-07-17 18:46:47,2,1,kebakaran,pencegahan,
707,tvOneNews,"Karhutla Terjadi di Taput, Satu Warga Hangus Terbakar https://t.co/4niW1NcdtA",karhutla jadi taput satu warga hangus bakar,2022-07-17 20:29:34,2,1,kebakaran,kebakaran,
708,polisisijunjung,"Di Pasar Inpres, Kasat Binmas Pimpin Kegiatan Satgas Berikan Penyuluhan Antisipasi Karhutla – POLRES SIJUNJUNG https://t.co/WF1ht3NnH9",pasar inpres kasat binmas pimpin giat satgas ikan suluh antisipasi karhutla polres sijunjung,2022-07-17 22:00:48,1,1,pencegahan,pencegahan,
709,Monitorind_news,Karhutla di Buntu Raja Tapanuli Utara Memakan Korban Jiwa https://t.co/1MD3ZDUpy3,karhutla buntu raja tapanuli utara makan korbanjiwa,2022-07-17 23:14:10,2,1,kebakaran,kebakaran,
710,GoRiauCom,"Karhutla Membara di Wilayah Perbatasan Riau - Sumbar, Pemadaman Terkendala Sumber Air https://t.co/XAgF8KQc3g #GoRiau",karhutla bara wilayah batas riau sumbar madam kendala sumber air goriau,2022-07-18 4:05:32,1,1,pencegahan,kebakaran,
712,SpiritRiau_com,"Hanguskan Kebun Warga, Dua Titik Karhutla Muncul di Kuala Kampar Pelalawan, Ini Lokasinya https://t.co/mKAaRDDfDh",hangus kebun warga titik karhutla muncul kuala kampar pelalawan lokasi,2022-07-18 9:11:21,1,1,pencegahan,kebakaran,
713,kumparan,"Penyebab karhutla di Desa Sitanggor, Kecamatan Muara, Kabupaten Tapanuli Utara, Sumatera Utara, masih diselidiki polisi. #kumparanNEWS https://t.co/6mPqyasLHy",karhutla desa sitanggor camat muara kabupaten tapanuli utara sumatera utara selidik polisi kumparannews,2022-07-18 9:54:06,1,1,pencegahan,penanggulangan,
714,metrojambi,"Ke Jambi, KSAD akan Tinjau Lokasi Rawan Karhutla - https://t.co/srxNm4p3xC | Berita Jambi Digital https://t.co/eW8eCjLAVO",jambi ksad tinjau lokasi rawan karhutla berita jambi digital,2022-07-18 9:57:05,2,1,kebakaran,pencegahan,
716,kodim0313kpr,Babinsa Serka Cipto Wibowo dan Bhabinkamtibmas Serta Perangkat Desa Bersinergi Pasang Spanduk Stop Karhutla https://t.co/eUBCY4TOl4,babinsa serka cipto wibowo bhabinkamtibmas perangkat desa sinergi pasang spanduk stop karhutla,2022-07-18 10:46:08,1,1,pencegahan,pencegahan,
717,Sugiant48229381,"KORAMIL 01/SMD DIM 0210/TU GIAT MELAKSANAKAN PATROLI KARHUTLA

Koramil 01/Simanindo giat untuk melaksanakan patroli Karhutla karena saat ini musim kemarau dan menghbau kepada masyarakat yang membuka lahan agar tidak membakar lahanya, Senin 18-07-2022. https://t.co/BUNLAtYGbx",koramil smd dim tu giat laksana patroli karhutlakoramil simanindo giat laksana patroli karhutla saat musim kemarau menghbau masyarakat buka lahan tidak bakar lahanya senin,2022-07-18 10:57:13,2,1,kebakaran,pencegahan,
718,kodim0313kpr,DEMI MELAKSANAKAN TUGAS BABINSA KORAMIL 14/KEPENUHAN RUTIN PATROLI KARHUTLA https://t.co/LcbpbxqMrs,laksana tugas babinsa koramil penuh rutin patroli karhutla,2022-07-18 11:30:33,2,1,kebakaran,mitigasi,
719,jpnncom,Kasi Humas Polres Tapanuli Utara Aiptu Walpon Baringbing menyebut kebakaran itu terjadi pada Sabtu (16/7) sekitar pukul 14.00 WIB. #Kebakaranhutan https://t.co/H6Ps6ICxgH,kasi humas polres tapanuli utara aiptu walpon baringbing sebut bakar jadi sabtu pukul wib kebakaranhutan,2022-07-18 12:00:04,1,1,pencegahan,kebakaran,
720,beritaKBR,"Banyak di antara kasus karhutla terjadi lantaran sengaja dibakar untuk kegiatan perluasan kebun baru.

#Aceh #karhutla

https://t.co/4TRlkBhxv3",banyak antara kasus karhutla jadi lantar sengaja bakar giat luas kebun baruaceh karhutla,2022-07-18 12:04:48,1,1,pencegahan,kebakaran,
721,detikcom,"Satu orang warga meninggal dunia dalam peristiwa Karhutla di Taput. Kebakaran kawasan hutan tersebut terjadi Sabtu dan baru dapat dipadamkan Minggu (17/7/2022).

Via: detikSumut  https://t.co/OW0AP90GIc",satu orang warga tinggal dunia peristiwa karhutla taput bakar kawasan hutan sebut jadi sabtu baru padam minggu via detiksumut,2022-07-18 12:09:14,1,1,pencegahan,kebakaran,
722,MsyaiinS,Semoga segera teratasi,moga segera atas,2022-07-18 12:14:44,3,1,unknow,unknow,
724,MedialokalCo,Babinsa Koramil 04/Kuindra Sosialisasikan Pencegahan Karhutla Bersama Masyarakat Peduli Api https://t.co/jrnGXBkrqv https://t.co/UFrTXQJtpM,babinsa koramil indra sosialisasi cegah karhutla sama masyarakat peduli api,2022-07-18 13:02:04,1,1,pencegahan,mitigasi,
725,kaltengtoday,"Kesiapan Tangkal Karhutla dan Banjir, Polres Bartim Adakan Apel Sarpras https://t.co/SSqJ79uSHC",kesiap tangkal karhutla banjir polres bartim adakan apelsarpras,2022-07-18 13:18:11,2,1,kebakaran,mitigasi,
726,red_Beritapojok,Babinsa Koramil 04 PWK Bersama BPBD Dumai Padamkan Karhutla di Pelintung https://t.co/uXtVxaOP3u,babinsa koramil pwk sama bpbd dumai padam karhutla dipelintung,2022-07-18 13:22:23,1,1,pencegahan,penanggulangan,
727,PerisaiHukumId,Bupati Lahat Pimpin Apel gelar pasukan dalam rangka karhutla. https://t.co/LjRS5fSOX3,bupati lahat pimpin apel gelar pasu rangkakarhutla,2022-07-18 13:49:03,2,1,kebakaran,penanggulangan,
728,ppidbengkalis,"Kasmarni Berharap Seluruh Intansi dan Stakeholder, Bangun Koordinasi Persiapan Penanganan Karhutla https://t.co/lp5Gtk9bd8 https://t.co/vlG3Q5mxS3",kasmarni harap seluruh intansi stakeholder bangun koordinasi siap tangan karhutla,2022-07-18 13:53:03,1,1,pencegahan,mitigasi,
729,SpiritRiau_com,Petugas Gabungan Gunakan Tangki Punggung Padamkan Karhutla di Perbatasan Riau-Sumbar https://t.co/Er2O4Kim42,tugas gabung tangki punggung padam karhutla batas riausumbar,2022-07-18 14:52:55,2,1,kebakaran,penanggulangan,
730,MedialokalCo,"Terkait Karhutla, Babinsa Koramil 09/Kemuning Lakukan Patroli dan Sosialisasi https://t.co/pBuIMKlgoa https://t.co/53ehd0asmB",kait karhutla babinsa koramil kemuning laku patroli sosialisasi,2022-07-18 15:00:37,2,1,kebakaran,mitigasi,
731,polsekbengkalis,Giat Patroli bersama dan pencegahan (mitigasi) Karhutla serta pengecekan sekat kanal  oleh Bhabinkamtibmas Polsek Bengkalis didesa Binaannya mengingat cuaca panas saat ini https://t.co/Y06DB1O8hZ,giat patroli sama cegah mitigasi karhutla kece sekat kanal bhabinkamtibmas polsek bengkal desa bina ingat cuaca panas ini,2022-07-18 15:03:21,1,1,pencegahan,mitigasi,
733,AndiPitopang6,"RT @jawapos: Karhutla Danau Toba Hanguskan 40 Hektare, 1 Orang Tewas https://t.co/6BXjZuovMO",karhutla danau toba hangus hektare orang tewas,2022-07-18 15:32:55,2,1,kebakaran,kebakaran,
734,CNNIndonesia,"Karhutla di Tapanuli Utara, 1 Orang Meninggal Saat Padamkan Api https://t.co/uCng33dptB",karhutla tapanuli utara orang tinggal padam api,2022-07-18 15:35:26,2,1,kebakaran,kebakaran,
735,halloriau,"Bupati Bengkalis Tinjau Pos Komando Bersama Operasi Siaga Karhutla

https://t.co/0ilxegatKB",bupati bengkal tinjau pos komando sama operasi siaga karhutla,2022-07-18 15:45:37,1,1,pencegahan,penanggulangan,
736,idntimes,RT @IDNTimesSumut: Korban tergelincir dan masuk ke dalam api https://t.co/cHrklxqO3b,korban gelincir masuk dalam api,2022-07-18 16:16:24,2,1,kebakaran,kebakaran,
737,syahroni_kabul,Apel Gelar Pasukan Dalam Rangka Karhutla. - https://t.co/PULBrQmrEJ,apel gelar pasu rangka karhutla,2022-07-18 16:33:04,2,1,kebakaran,mitigasi,
739,kodim0303,"Dandim 0303/Bengkalis Letkol Inf Endik Yunia Hermanto diwakili Kasdim 0303/Bengkalis Mayor Arh Sudiyono menghadiri Upacara Bendera peringatan hari Kesadaran Nasional dan Apel Siap siaga Darurat Bencana Karhutla Tahun 2022.
Senin, ( 18/07/2022). https://t.co/hgHIs5gDDO",dandim bengkal letkol inf endik yunia hermanto wakil kasdim bengkal mayor arh sudiyono hadir upacara bendera ingat hari sadar nasional apel siap siaga darurat bencana karhutla tahun senin,2022-07-18 16:39:58,1,1,pencegahan,mitigasi,
744,Khalfani_co_id,Sekda Kalsel Rapat Penyusunan Kontingensi Karhutla https://t.co/n9wKvkpUgn,sekda kalsel rapat susun kontingensikarhutla,2022-07-18 16:52:07,2,1,kebakaran,mitigasi,
745,redberkalteng,Polres Barito Timur Gelar Apel Kesiapan dan Antisipasi Bencana Alam dan Karhutla https://t.co/tcvYOyhkSc,polres barito timur gelar apel kesiap antisipasi bencana alam dankarhutla,2022-07-18 17:09:42,1,1,pencegahan,mitigasi,
