id,screen_name,text,clean_text,dt,label_id,is_predict,label_name,label,Desc
944,PolresBanjar,"STOP KARHUTLA!!! 
Ingat!!!....Membakar Hutan dan Lahan Berarti Membakar Masa Depan. https://t.co/N6tWrLf6Pu",stop karhutla ingatmembakar hutan lahan arti bakar masa depan,2022-07-22 12:42:59,1,1,pencegahan,pencegahan,
945,mediaindonesia,"Hadapi Puncak Musim Kemarau, KLHK Intensifkan Penanganan Karhutla di Sejumlah Daerah  https://t.co/poxWUvJO0c",hadap puncak musim kemarau klhk intensif tangan karhutla jumlah daerah,2022-07-22 13:33:30,1,1,pencegahan,penanggulangan,
946,PolsekKuntoDs,"BHABINKAMTIBMAS DESA MUARA DILAM MELAKSANAKAN PATROLI KARHUTLA DI WILAYAH DESA MUARA DILAM, DIMANA HINGGA SAAT SEKARANG SITUASI AMAN DAN TIDAK DITEMUKAN ADANYA TITIK API.

#humaspoldariau
#hunaspolresrokanhulu
#bagopspolresrohul
#humaspolsekkuntodarussalam https://t.co/4VQTickqmh",bhabinkamtibmas desa muara dilam laksana patroli karhutla wilayah desa muara dilam mana hingga sekarang situasi aman tidak temu titik apihumaspoldariauhunaspolresrokanhulubagopspolresrohulhumaspolsekkuntodarussalam,2022-07-22 13:43:32,1,1,pencegahan,mitigasi,
947,satbrimobkalbar,"Siaga Karhutla Satbrimob Polda Kalbar dalam mengantisipasi Karhutla, personil Batalyon A Pelopor melaksanakan latihan dalam mengaplikasikan peralatan mobil Karhutla. https://t.co/oiSvdnbr07",siaga karhutla satbrimob polda kalbar antisipasi karhutla personil batalyon a pelopor laksana latih aplikasi alat mobil karhutla,2022-07-22 14:23:39,1,1,pencegahan,mitigasi,
948,MedialokalCo,Babinsa Koramil 04/Kuindra Bersama Petani Kelapa Laksanakan Sosialisasi Karhutla https://t.co/sDgKGAjevO https://t.co/O7t7H7VIYy,babinsa koramil indra sama tani kelapa laksana sosialisasi karhutla,2022-07-22 14:55:07,1,1,pencegahan,pencegahan,
949,NTMC_Info,"Cegah dan Deteksi Penyebaran Karhutla, Polda Kaltim Launching Aplikasi ASAP Digital

https://t.co/A78Y3l42OA",cegah deteksi sebar karhutla polda kaltim launching aplikasi asap digital,2022-07-22 15:02:10,1,1,pencegahan,pencegahan,
950,polsekbengkalis,Patroli dan pencegahan (mitigasi) karhutla diwilayah hukum Polsek Bengkalis https://t.co/6VR5P1JIZS,patroli cegah mitigasi karhutla wilayah hukum polsek bengkal,2022-07-22 15:10:41,2,1,kebakaran,pencegahan,
951,MedialokalCo,Kopral Satu Surianto Laksanakan Patroli Karhutla Bersama Warga Desa https://t.co/VxLGNS1VMM https://t.co/lJJSLw6MTw,kopral satu surianto laksana patroli karhutla sama warga desa,2022-07-22 15:12:06,1,1,pencegahan,pencegahan,
953,InfoHumasBMKG,"Sore #SobatBMKG
Mimin bawa update info terkait titik panas 21 Juli 2022 nih!

Terpantau ada total 15 titik panas indikasi karhutla di wilayah; Kalbar (6), Kalut (5), NTB (1), NTT (1), Sulteng (2). Yuk kita hindari kegiatan yg memicu kebakaran hutan ya Sobat!?

#TitikPanas
#BMKG https://t.co/YToCc0JjIa",sore sobatbmkgmimin bawa update info kait titik panas juli nihterpantau total titik panas indikasi karhutla wilayah kalbar kalut ntb ntt sulteng yuk hindar giat yg picu bakar hutan sobattitikpanasbmkg,2022-07-22 15:25:43,2,1,kebakaran,kebakaran,
955,TNPoliticsBot,"RT @BaratBangkinang: Zoom Anev Percepatan Vaksinasi, Penanganan Oan II Penanganan PMK dan Karhutla di wilkum Polres/Ta Jajaran Polda Riau h…",zoom anev cepat vaksinasi tangan oan ii tangan pmk karhutla wilkum polresta jajar polda riau h,2022-07-22 16:02:28,1,1,pencegahan,penanggulangan,
956,NTMC_Info,"Polda Kaltim Launching Aplikasi ASAP Digital, Strategis Cegah Karhutla 

https://t.co/Bvq1vZKCND",polda kaltim launching aplikasi asap digital strategis cegah karhutla,2022-07-22 16:05:40,1,1,pencegahan,pencegahan,
957,Polsek_Taphil,"Zoom Anev Percepatan Vaksinasi, Penanganan Oan II Penanganan PMK dan Karhutla di wilkum Polres/Ta Jajaran Polda Riau https://t.co/CmbF5xA2Oq",zoom anev cepat vaksinasi tangan oan ii tangan pmk karhutla wilkum polresta jajar polda riau,2022-07-22 16:06:05,1,1,pencegahan,penanggulangan,
958,TNPoliticsBot,"RT @Polsek_Taphil: Zoom Anev Percepatan Vaksinasi, Penanganan Oan II Penanganan PMK dan Karhutla di wilkum Polres/Ta Jajaran Polda Riau htt…",zoom anev cepat vaksinasi tangan oan ii tangan pmk karhutla wilkum polresta jajar polda riau htt,2022-07-22 16:06:10,1,1,pencegahan,penanggulangan,
959,kodim0322siak,"Cegah Karhutla, Babinsa Kampung Bandar Sungai Gelar Patroli Bersama
https://t.co/OfUYgtSBtq",cegah karhutla babinsa kampung bandar sungai gelar patroli sama,2022-07-22 16:08:09,1,1,pencegahan,pencegahan,
960,TutiYunita2,"Deteksi Dini Karhutla, Polda dan Telkom Luncurkan ASAP Digital
#DigitalBisa #UntukIndonesiaLebihBaik #DigitalUntukKitaSemua https://t.co/tzHVDXQU5O",deteksi dini karhutla polda telkom luncur asap digitaldigitalbisa untukindonesialebihbaik digitaluntukkitasemua,2022-07-22 17:28:40,1,1,pencegahan,pencegahan,
961,TutiYunita2,"Kapolda Kaltim, Irjen Imam Sugianto mengatakan, saat ini Kaltim mendapat tambahan delapan titik kamera cctv di menara BTS milik PT Telkom untuk mengawasi karhutla.
#DigitalBisa #UntukIndonesiaLebihBaik #DigitalUntukKitaSemua https://t.co/6EimlblpyN",kapolda kaltim irjen imam sugianto kata ini kaltim tambah delapan titik kamera cctv menara bts milik pt telkom awas karhutladigitalbisa untukindonesialebihbaik digitaluntukkitasemua,2022-07-22 17:30:38,1,1,pencegahan,mitigasi,
962,KailaNandia,"Nah gais, ASAP Digital adalah sebuah aplikasi yang dikembangkan oleh PT Telkom untuk mendeteksi dini kebakaran hutan dan lahan (karhutla) yang kerap terjadi di wilayah Indonesia, tak terkecuali Kaltim.
#DigitalBisa #UntukIndonesiaLebihBaik #DigitalUntukKitaSemua https://t.co/QRsVYpKxdw",nah gais asap digital buah aplikasi kembang pt telkom deteksi dini bakar hutan lahan karhutla kerap jadi wilayah indonesia tak kaltimdigitalbisa untukindonesialebihbaik digitaluntukkitasemua,2022-07-22 17:32:01,1,1,pencegahan,pencegahan,
963,wowsiapdotcom,"Cegah Karhutla, Polda Kaltim Launching Aplikasi ASAP Digital
https://t.co/JPHeLlosWx @Poldakaltim @hms_poldakaltim @DPoldakaltim @SPoldakaltim @affsembiring @bpbdkaltim",cegah karhutla polda kaltim launching aplikasi asap digital,2022-07-22 17:35:02,2,1,kebakaran,pencegahan,
964,KailaNandia,"Untuk Antisipasi Karhutla, Polda Kaltim Launching Aplikasi ASAP Digital
#DigitalBisa #UntukIndonesiaLebihBaik #DigitalUntukKitaSemua https://t.co/C8EmHjKJ1u",antisipasi karhutla polda kaltim launching aplikasi asap digitaldigitalbisa untukindonesialebihbaik digitaluntukkitasemua,2022-07-22 17:35:47,1,1,pencegahan,pencegahan,
965,AnjanaKeila,"ASAP Digital adalah sebuah aplikasi yang dikembangkan oleh PT Telkom untuk mendeteksi dini kebakaran hutan dan lahan (karhutla) yang kerap terjadi di wilayah Indonesia, tak terkecuali Kaltim.
#DigitalBisa #UntukIndonesiaLebihBaik #DigitalUntukKitaSemua https://t.co/kDm1kVQmtL",asap digital buah aplikasi kembang pt telkom deteksi dini bakar hutan lahan karhutla kerap jadi wilayah indonesia tak kaltimdigitalbisa untukindonesialebihbaik digitaluntukkitasemua,2022-07-22 17:42:16,1,1,pencegahan,pencegahan,
966,AmaliaSisda,"Pastinya Kaltim mendapat tambahan delapan titik kamera cctv di menara BTS milik PT Telkom untuk mengawasi karhutla.
#DigitalBisa #UntukIndonesiaLebihBaik #DigitalUntukKitaSemua https://t.co/0FBAlKxUI2",kaltim tambah delapan titik kamera cctv menara bts milik pt telkom awas karhutladigitalbisa untukindonesialebihbaik digitaluntukkitasemua,2022-07-22 17:44:34,1,1,pencegahan,mitigasi,
967,AmaliaSisda,"Telkom berharap, ke depan akan semakin banyak titik yang bisa dipantau langsung, sehingga potensi karhutla bisa diantisipasi.
#DigitalBisa #UntukIndonesiaLebihBaik #DigitalUntukKitaSemua https://t.co/jhReXu8y5s",telkom harap depan makin banyak titik pantau langsung potensi karhutla bisa diantisipasidigitalbisa untukindonesialebihbaik digitaluntukkitasemua,2022-07-22 17:45:36,1,1,pencegahan,pencegahan,
968,voidotid,Titik panas mulai bermunculan di Provinsi Riau. BRIN melakukan sejumlah pencegahan terhadap potensi kebakaran hutan dan lahan (karhutla) itu dengan melakukan modifikasi cuaca. https://t.co/79yJWanqs1,titik panas mulai muncul provinsi riau brin laku jumlah cegah hadap potensi bakar hutan lahan karhutla dengan laku modifikasi cuaca,2022-07-22 19:34:43,5,1,rehabilitasi,penanggulangan,
969,habibia44,"Deteksi Dini Karhutla, Telkom dan Polda Kaltim Luncurkan ASAP Digital

#DigitalBisa #UntukIndonesiaLebihBaik #DigitalBisaUntukSemua https://t.co/I9ftmaBpnG",deteksi dini karhutla telkom polda kaltim luncur asap digitaldigitalbisa untukindonesialebihbaik digitalbisauntuksemua,2022-07-22 20:03:47,1,1,pencegahan,pencegahan,
970,habibia44,"Upaya mendeteksi dini karhutla, telkom luncurkan ASAP Digital yg merupakan aplikasi mendeteksi dini kebakaran hutan dan lahan (karhutla) yang kerap terjadi di wilayah Indonesia, tak terkecuali Kaltim.
#DigitalBisa #UntukIndonesiaLebihBaik #DigitalUntukKitaSemua https://t.co/w7np0TZaKG",upaya deteksi dini karhutla telkom luncur asap digital yg rupa aplikasi deteksi dini bakar hutan lahan karhutla kerap jadi wilayah indonesia tak kaltimdigitalbisa untukindonesialebihbaik digitaluntukkitasemua,2022-07-22 20:04:37,1,1,pencegahan,pencegahan,
971,habibia44,"Bismillah ya semoga bisa memaksimalkan pencegahan karhutla, ya dengan kerja sama ini maka implementasi ASAP digital akan lebih mudah
#DigitalBisa #UntukIndonesiaLebihBaik #DigitalBisaUntukSemua https://t.co/PehdWJlUig",bismillah moga maksimal cegah karhutla dengan kerja sama maka implementasi asap digital lebih mudahdigitalbisa untukindonesialebihbaik digitalbisauntuksemua,2022-07-22 20:05:27,1,1,pencegahan,pencegahan,
972,calebaqliii,"Aplikasi Sistem Analisa Pengendalian Karhutla Digital besutan Telkom Indonesia. 

#DigitalBisa #UntukIndonesiaLebihBaik #DigitalBisaUntukSemua https://t.co/xhK88aFzw8",aplikasi sistem analisa kendali karhutla digital besut telkom indonesia digitalbisa untukindonesialebihbaik digitalbisauntuksemua,2022-07-22 20:07:46,1,1,pencegahan,pencegahan,
973,tasyaalifani,"Telkom Indonesia kembali berperan untuk pengendalian karhutla yaitu luncurkan ASAP Digital ini Telkom ingin berperan dalam monitoring dan analisis sehingga kebakaran hutan dan lahan tak meluas.
#DigitalBisa #UntukIndonesiaLebihBaik #DigitalBisaUntukSemua https://t.co/Fu0G3MvqHY",telkom indonesia peran kendali karhutla luncur asap digital telkom peran monitoring analisis bakar hutan lahan tak meluasdigitalbisa untukindonesialebihbaik digitalbisauntuksemua,2022-07-22 20:10:20,1,1,pencegahan,penanggulangan,
974,ardivasatrio,"Wah keren nih deteksi dini karhutla  Telkom berharap, ke depan akan semakin banyak titik yang bisa dipantau langsung, sehingga potensi karhutla bisa diantisipasi.
#DigitalBisa #UntukIndonesiaLebihBaik #DigitalBisaUntukSemua https://t.co/IRJ9sXRatd",wah keren nih deteksi dini karhutla telkom harap depan makin banyak titik pantau langsung potensi karhutla bisa diantisipasidigitalbisa untukindonesialebihbaik digitalbisauntuksemua,2022-07-22 20:39:56,1,1,pencegahan,pencegahan,
977,Cyber_Media86,"Monitoring Karhutla,Personel Polsek Ciwandan Polres Cilegon Polda Banten Cek Titik Api https://t.co/CslJOKgpa0",monitoring karhutlapersonel polsek ciwandan polres cilegon polda banten cek titikapi,2022-07-22 22:13:46,1,1,pencegahan,pencegahan,
983,HENDRIDEEN1,"Kabut Asap Mulai Kepung Riau, Ribuan Lahan Terbakar, Ini Dia Cakupan Luas Karhutla https://t.co/rn5zpel04v",kabut asap mulai kepung riau ribu lahan bakar dia cakup luas karhutla,2022-07-22 22:46:30,1,1,pencegahan,kebakaran,
986,jpnncom,"Kapolda Riau memiliki langkah pencegahan, penindakan, hingga pendidikan untuk mencegah karhutla. #IrjenIqbal https://t.co/nM3cX5N70V",kapolda riau milik langkah cegah tindak hingga didik cegah karhutla irjeniqbal,2022-07-23 2:01:02,1,1,pencegahan,mitigasi,
987,Zyanpatra,Ikhtiar Irjen Iqbal Tangani Karhutla: Demi Riau Bebas Asap dan Langit Biru https://t.co/wUcoMNSTjV,ikhtiar irjen iqbal tangan karhutla riau bebas asap langitbiru,2022-07-23 2:22:58,1,1,pencegahan,pencegahan,
989,Tio_Rud,"@kompascom Upaya PENCEGAHAN KARHUTLA dg PENEGAKAN HUKUM hrs adil kpd semua PIHAK;Thd PELAKU KARHUTLA &amp; Pihak terkait yg hrs dimintakan TANGGUNGJAWABNYA,yaitu:Pemegang/Pemilik KONSESI (Perusahaa &amp; BUMN) Pejabat Areal Kawasan HUTAN Negara (Lindung,Konservasi &amp; sejenisnya) @jokowi @mohmahfudmd",upaya cegah karhutla dg tega hukum hrs adil kpd semua pihakthd laku karhutla amp pihak kait yg hrs minta tanggungjawabnyayaitupemegangpemilik konsesi perusahaa amp bumn jabat areal kawasan hutan negara lindungkonservasi amp jenis,2022-07-23 5:37:22,5,1,rehabilitasi,pencegahan,
990,PoldaKaltara_,"Kegiatan Kepolisian Rutin Yang Di tingkatkan berupa Himbauan Kamtibmas,bahaya Narkoba, Karhutla, Keselamatan aktifitas perairan, serta senantiasa mematuhi Protokol Kesehatan di wilayah Kota Tarakan (22/07/2022)

@DivHumas_Polri
@PolresTarakan
#poldakaltara https://t.co/x5Rmqr3Z5b",giat polisi rutin tingkat upa himbauan kamtibmasbahaya narkoba karhutla selamat aktifitas air senantiasa patuh protokol sehat di wilayah kota tara,2022-07-23 6:32:57,1,1,pencegahan,mitigasi,
993,azelaasesh,"Good Job Telkom jadi solusi dlm pencegahan karhutla, Telkom launch aplikasi Asap Digital, komitmen tinggi cegah karhutla di wilayah Kalimantan Timur
#Digitalbisa #UntukIndonesiaLebihBaik #DigitalBisaUntukSemua https://t.co/9GjmUvDBd3",good job telkom jadi solusi dlm cegah karhutla telkom launch aplikasi asap digital komitmen tinggi cegah karhutla wilayah kalimantan timurdigitalbisa untukindonesialebihbaik digitalbisauntuksemua,2022-07-23 7:34:15,2,1,kebakaran,pencegahan,
994,TriyonoJono,Telkom Indonesia luar biasa kontribusinya utk pengendalian Karhutla di Kalimantan Timur. Kali ini kembali dngn aplikasi ASAP Digital yg berperan monitoring dan analisis dgn tujuan pencegahan maupun karhutla tidak meluas #Digitalbisa #DigitalBisaUntukSemua #UntukIndonesiaLebihBaik https://t.co/xPZ93yCuPl,telkom indonesia luar biasa kontribusi utk kendali karhutla kalimantan timur kali kembali dngn aplikasi asap digital yg peran monitoring analisis dgn tuju cegah maupun karhutla luas digitalbisa digitalbisauntuksemua untukindonesialebihbaik,2022-07-23 7:36:47,5,1,rehabilitasi,pencegahan,
995,IndyPutrrr,Ikhtiar Irjen Iqbal Tangani Karhutla: Demi Riau Bebas Asap dan Langit Biru https://t.co/zPjsMM6vmT https://t.co/kaEFgssHEC,ikhtiar irjen iqbal tangan karhutla riau bebas asap langit biru,2022-07-23 7:54:13,1,1,pencegahan,pencegahan,
998,DalmaTiyon,"Indonesia darurat lingkungan. Karhutla banyak terjadi. Muslimah Youth Forum membahas ini. Simak juga video ini gaes.. https://t.co/mUbZuML8G3
#IslamSelamatkanGenerasi
#PotensiGenerasiDibajak
#KapitalisasiPemuda",indonesia darurat lingkung karhutla banyak jadi muslimah youth forum bahas simak video gaes,2022-07-23 8:26:30,1,1,pencegahan,pencegahan,
1009,InhuLirik,"Kapolsek Lirik AKP Aman Aroni, SH beserta anggota melakukan pemasangan spanduk himbauan Karhutlah, pengecekan menara pantau karhutla serta pengecekan peralatan untuk antisipasi karhutla di PT. Teso Indah Desa Pasir Ringgit. https://t.co/uBQmMcbAS2",kapolsek lirik akp aman aron sh anggota laku pasang spanduk himbauan karhutlah kece menara pantau karhutla kece alat antisipasi karhutla pt teso indah desa pasir ringgit,2022-07-23 8:33:27,2,1,kebakaran,pencegahan,
1010,cenyaanaya,"Dimana-mana ada Karhutla. Solusinya apa yaa?

Muslimah Youth Forum 1443
#PotensiGenerasiDibajak #IslamSelamatkanGenerasi",dimanamana karhutla solusi apa yaamuslimah youth forum potensigenerasidibajak islamselamatkangenerasi,2022-07-23 8:38:41,1,1,pencegahan,kebakaran,
1012,WipolKarbol,"Bumi gak sedang baik-baik saja. Iklim, cupcakes, panas ekstrem, karhutla. Apa solusi untuk menyelesaikan masalah ini? Untuk aja di Muslimah Youth Forum dibahas 
#IslamSelamatkanGenerasi
#PotensiGenerasiDibajak
#KapitalisasiPemuda https://t.co/feVywwOhdB",bumi gak sedang baikbaik iklim cupcakes panas ekstrem karhutla apa solusi selesai masalah untuk aja muslimah youth forum bahas islamselamatkangenerasipotensigenerasidibajakkapitalisasipemuda,2022-07-23 8:43:12,1,1,pencegahan,pencegahan,
1013,InhuLirik,"Kapolsek Lirik AKP Aman Aroni, SH beserta anggota melakukan pengecekan peralatan untuk antisipasi karhutla di PT. Teso Indah Desa Pasir Ringgit. https://t.co/uT4EiQoiqM",kapolsek lirik akp aman aron sh anggota laku kece alat antisipasi karhutla pt teso indah desa pasir ringgit,2022-07-23 8:45:57,1,1,pencegahan,pencegahan,
1015,MakEmmak,"RT @cenyaanaya: Parah banget, Karhutla di mana-mana
Muslimah Youth Forum 1443
#PotensiGenerasiDibajak #IslamSelamatkanGenerasi",parah banget karhutla manamanamuslimah youth forum potensigenerasidibajak islamselamatkangenerasi,2022-07-23 8:47:59,2,1,kebakaran,kebakaran,
1019,kuansing_humas,"""Tidak ada yang hebat, kebersamaan Sinergitas seluruh pihak sangat dibutuhkan dalam penanganan karhutla.""

-Kapolda Riau-

IRJEN POL M. IQBAL, S.I.K., https://t.co/R0dCrUOwAA

@HumasPoldaRiau https://t.co/ZhAhChCQtM",ada hebat sama sinergitas seluruh pihak sangat butuh tangan karhutlakapolda riauirjen pol m iqbal sik,2022-07-23 9:23:02,1,1,pencegahan,mitigasi,
1020,ArintaSetia,"Perlu kita tahu, sebagian wilayah Kalimantan berupa lahan gambut. Kebakaran hutan dan lahan (karhutla) di lahan gambut telah menjadi masalah cukup pelik setiap tahunnya, contoh parah karhutla 2015

Lahan gambut di hutan Kalimantan Tengah (dokpri)

#UntukmuBumiku
#TeamupForImpact https://t.co/Tl7fsmYyLk",perlu tahu wilayah kalimantan upa lahan gambut bakar hutan lahan karhutla lahan gambut jadi masalah cukup pelik tiap tahun contoh parah karhutla lahan gambut hutan kalimantan tengah dokpriuntukmubumikuteamupforimpact,2022-07-23 9:23:59,1,1,pencegahan,pencegahan,
1021,SATLANTASROHIL1,"""Tidak ada yang hebat, yang hebat adalah kebersamaan. Begitupun dalam penanganan Karhutla"", Kapolda Riau 

@RTMCRiau 
@HumasPoldaRiau 
@dit_kamsel 
@Sosmed_NTMC 
@NTMCLantasPolri https://t.co/UJ3keNFwoh",ada hebat hebat sama dalam tangan karhutla kapolda riau,2022-07-23 9:24:34,1,1,pencegahan,pencegahan,
1024,SpiritRiau_com,"Karhutla di Kecamatan Bangko Rohil Berangsur Padam, Petugas Terus Lakukan Pendinginan https://t.co/Pmx3EJGRhY",karhutla camat bangko rohil angsur padam tugas terus laku dingin,2022-07-23 9:41:27,1,1,pencegahan,mitigasi,
1027,bunut_polsek,"Cuaca Ekstrem, Karhutla Tetap Terkendali. https://t.co/MTl3PKrtuj",cuaca ekstrem karhutla tetap kendali,2022-07-23 9:45:31,2,1,kebakaran,mitigasi,
1030,bunut_polsek,"Bersatu Tangani Karhutla, Langit Biru Harus Dijaga. https://t.co/quFIo8TKqR",satu tangan karhutla langit biru jaga,2022-07-23 9:48:57,2,1,kebakaran,pencegahan,
1033,ResRohul,"Musim Kemarau Tiba,Kapolres Rokan Hulu AKBP Pangucap Priyo Soegito,S.I.K,M.H Himbau Masyarakat Tidak Membakar Hutan dan Lahan. 
Mati Kita Jaga Hutan Agar Langit Tetap Biru
.

https://t.co/z9smA7Ub4b https://t.co/SJSdYRWGgK",musim kemarau tibakapolres rok hulu akbp pangucap priyo soegitosikmh himbau masyarakat bakar hutan lahan mati jaga hutan langit tetap biru,2022-07-23 9:56:07,5,1,rehabilitasi,pencegahan,
1035,ResRohul,"Musim Kemarau Tiba,Kapolres Rokan Hulu AKBP Pangucap Priyo Soegito,S.I.K,M.H Himbau Masyarakat Tidak Membakar Hutan dan Lahan.
.

https://t.co/dBZMJrcELO https://t.co/KDognudOum",musim kemarau tibakapolres rok hulu akbp pangucap priyo soegitosikmh himbau masyarakat bakar hutan lahan,2022-07-23 9:57:00,1,1,pencegahan,pencegahan,
1036,ResRohul,"Musim Kemarau Tiba,Kapolres Rokan Hulu AKBP Pangucap Priyo Soegito,S.I.K,M.H Himbau Masyarakat Tidak Membakar Hutan dan Lahan. 
Mari Kita Jaga Hutan Agar Langit Tetap Biru
.

https://t.co/z9smA7Ub4b https://t.co/C92qrhSwhY",musim kemarau tibakapolres rok hulu akbp pangucap priyo soegitosikmh himbau masyarakat bakar hutan lahan kita jaga hutan langit tetap biru,2022-07-23 10:02:33,5,1,rehabilitasi,pencegahan,
1037,rengat_barat,"""Kebersamaan Kami , TNI, POLRI , MANGGALA AGNI , KPBD Dan MPA  Dalam Menanggulangi Karhutla , TETAP SEMANGAT !!! "" https://t.co/609YuTwRtj",sama tni polri manggala agni kpbd mpa tanggulang karhutla tetap semangat,2022-07-23 10:03:25,1,1,pencegahan,penanggulangan,
1038,ResRohul,"Musim Kemarau Tiba,Kapolres Rokan Hulu AKBP Pangucap Priyo Soegito,S.I.K,M.H Himbau Masyarakat Tidak Membakar Hutan dan Lahan. Mari Jaga Hutan Dan Agar Langit Kita Tetap Biru.
Polsek Tandun Polres Rokan Hulu Cek Lokasi dan Patroli Karhutla Di Bukit suligi https://t.co/wHlX6jFOwl",musim kemarau tibakapolres rok hulu akbp pangucap priyo soegitosikmh himbau masyarakat bakar hutan lahan jaga hutan agar langit tetap birupolsek tandun polres rok hulu cek lokasi patroli karhutla bukit suligi,2022-07-23 10:04:39,2,1,kebakaran,pencegahan,
1039,ResRohul,"Stop Membakar Hutan dan Lahan.
Musim Kemarau Tiba,Kapolres Rokan Hulu AKBP Pangucap Priyo Soegito,S.I.K,M.H Himbau Masyarakat Tidak Membakar Hutan dan Lahan. Mari Jaga Hutan Dan Agar Langit Kita Tetap Biru.
Polsek Tandun Polres Rokan Hulu Cek Lokasi dan Patroli Karhutla. https://t.co/rrJROgbMz9",stop bakar hutan lahanmusim kemarau tibakapolres rok hulu akbp pangucap priyo soegitosikmh himbau masyarakat bakar hutan lahan jaga hutan agar langit tetap birupolsek tandun polres rok hulu cek lokasi patroli karhutla,2022-07-23 10:08:24,5,1,rehabilitasi,pencegahan,
1040,polsek_lesung,Personil polsek pangkalan lesung bersama dengan tokoh masyarakat melaksanakan patroli karhutla untuk mencegah terjadinya kebakaran hutan dan lahan diwilayah Polsek Pangkalan Lesung https://t.co/aXFDiQwNX7,personil polsek pangkal lesung sama tokoh masyarakat laksana patroli karhutla cegah jadi bakar hutan lahan wilayah polsek pangkal lesung,2022-07-23 10:10:35,1,1,pencegahan,pencegahan,
1049,bertuahpos,"Potensi Karhutla Meningkat, TMC Periode II di Riau Berlangsung 11 Hari https://t.co/8xCV5K9Gr0",potensi karhutla tingkat tmc periode ii riau langsung hari,2022-07-23 10:20:16,1,1,pencegahan,kebakaran,
1051,sektorsungai9,Sinergi pemadaman Karhutla di Kecamatan Sungai Sembilan. https://t.co/MTzPSM3hOe,sinergi madam karhutla camat sungai sembilan,2022-07-23 10:23:45,2,1,kebakaran,penanggulangan,
1052,bunut_polsek,"Ps.Kanit Samapta Polsek Bunut Aipda A.Arif Sitompul, S.H ,Bhabinkamtibmas Ds.Sungai Buluh &amp; Ds.Lubuk Mas Aipda Cannon beserta Security PT.Arara Abadi melaksanakan giat patroli Antisipasi Karhutla diareal HTI PT. Arara abadi di Ds.Sungai Buluh Kec.Bunut Situasi Aman dan Kondusif . https://t.co/TeFIWtdWcZ",pskanit samapta polsek bunut aipda aarif sitompul sh bhabinkamtibmas dssungai buluh amp dslubuk mas aipda cannon security ptarara abadi laksana giat patroli antisipasi karhutla areal hti pt arara abadi dssungai buluh kecbunut situasi aman kondusif,2022-07-23 10:24:01,1,1,pencegahan,pencegahan,
1053,kodim0313kpr,"Tak Lengah, Babinsa Sertu M. Rasul Bersama Warga Rutin Gelar Patroli Karhutla https://t.co/YQsIiB0Ez1",tak lengah babinsa sertu m rasul sama warga rutin gelar patroli karhutla,2022-07-23 10:27:00,1,1,pencegahan,pencegahan,
1056,HumasMinas,"""Tidak ada yang hebat, yang hebat adalah kebersamaan. Sinergitas dari seluruh pihak sangat dibutuhkan dalam penanganan Karhutla ini,""

#BersamaLawanKarhutla
Sigap Tanggap Peduli
#humaspolsekminas https://t.co/bxYHagWdXm",ada hebat hebat sama sinergitas seluruh pihak sangat butuh tangan karhutla inibersamalawankarhutlasigap tanggap pedulihumaspolsekminas,2022-07-23 10:32:33,1,1,pencegahan,pencegahan,
1060,kodim0313kpr,Babinsa Koramil 11/Tbs Patroli dan Sosialisasi Cegah Karhutla https://t.co/k2ZT0LHLXk,babinsa koramil tbs patroli sosialisasi cegah karhutla,2022-07-23 10:38:25,2,1,kebakaran,pencegahan,
1062,NovendraYadi,"""Tidak ada yang hebat, yang hebat adalah kebersamaan. Sinergitas dari seluruh pihak sangat dibutuhkan dalam penanganan Karhutla ini,"" https://t.co/g4aG2k8OwO",ada hebat hebat sama sinergitas seluruh pihak sangat butuh tangan karhutla,2022-07-23 10:39:55,1,1,pencegahan,pencegahan,
1063,kodim0313kpr,BABINSA HIMBAU PROKES PENEGAKAN DISIPLIN DAN SOSIALISASI KARHUTLA. https://t.co/jpa0CfxwX8,babinsa himbau prokes tega disiplin sosialisasi karhutla,2022-07-23 10:43:01,2,1,kebakaran,pencegahan,
1066,HumasResInhu,"Jaga Langit Tetap Biru, Polda Riau Komitmen Sinergi Tangani Karhutla

PEKANBARU - Penanganan kebakaran hutan dan lahan (Karhutla), menjadi satu dari program prioritas dari Kapolda Riau, Irjen Pol Mohammad Iqbal. 

@DivHumas_Polri https://t.co/ia2rXeEtR0",jaga langit tetap biru polda riau komitmen sinergi tangan karhutlapekanbaru tangan bakar hutan lahan karhutla jadi satu program prioritas kapolda riau irjen pol mohammad iqbal,2022-07-23 10:46:11,2,1,kebakaran,penanggulangan,
1076,azelaasesh,"RT @azelaasesh: Good Job Telkom jadi solusi dlm pencegahan karhutla, Telkom launch aplikasi Asap Digital, komitmen tinggi cegah karhutla di…",good job telkom jadi solusi dlm cegah karhutla telkom launch aplikasi asap digital komitmen tinggi cegah karhutla,2022-07-23 10:59:01,2,1,kebakaran,pencegahan,
1077,azelaasesh,RT @TriyonoJono: Telkom Indonesia luar biasa kontribusinya utk pengendalian Karhutla di Kalimantan Timur. Kali ini kembali dngn aplikasi AS…,telkom indonesia luar biasa kontribusi utk kendali karhutla kalimantan timur kali kembali dngn aplikasi as,2022-07-23 10:59:07,1,1,pencegahan,pencegahan,
1078,kodim0313kpr,Babinsa Koramil 03 Bunut Bersama RPK Arara Abadi Cegah Karhutla Melalui Patroli https://t.co/ciUQyOyfC3,babinsa koramil bunut sama rpk arara abadi cegah karhutla lalu patroli,2022-07-23 11:00:09,1,1,pencegahan,pencegahan,
1080,nona_nonie99,"generasi muda ngomogin lingkungan it's okey...

Muslimah Youth Forum 
#KapitalisasiPemuda #IslamSelamatkanGenerasi",generasi muda ngomogin lingkung its okeymuslimah youth forum kapitalisasipemuda islamselamatkangenerasi,2022-07-23 11:00:27,1,1,pencegahan,pencegahan,
1082,Polsek_50Pku,"""Tidak ada yang hebat, yang hebat adalah kebersamaan. Begitupun dalam penanganan Karhutla,""

#BersamaLawanKarhutla
Sigap Tanggap Peduli https://t.co/fQ36vuij0M",ada hebat hebat sama dalam tangan karhutlabersamalawankarhutlasigap tanggap peduli,2022-07-23 11:07:55,1,1,pencegahan,pencegahan,
